{
  "$schema": "../../schemas/asset.schema.json",
  "schemaVersion": 2,
  "id": "newtons-third-law",
  "title": "Newton's third law of motion (নিউটনের তৃতীয় গতি সূত্র)",
  "type": "interactive",
  "entry": "index.html",
  "version": "1.1.0",
  "book": "physics-9-10",
  "page": 84,
  "topic": "3.8",
  "placement": "Book pages 84–86, topic 3.8: নিউটনের তৃতীয় গতি সূত্র (Newton's Third Law of Motion). Next to the boxed law, the action–reaction paragraph and চিত্র ৩.১২ (an apple and the Earth pulling each other).",
  "order": 1,
  "maintainers": ["RadeenXALNW"],
  "units": "m",
  "description": "Newton's third law (Physics 9–10, topic 3.8, pp84–86): a boy jumps from a wooden boat onto a jetty while the boat recoils. Equal, opposite horizontal contact forces act on two different bodies only while his feet push on the boat; after takeoff, separate velocity arrows show the motion. The apple–Earth lesson has three paused steps: a six-times-slower fall with a ghost start and trail, an equal-force comparison naming who pulls whom, and an in-lesson mass-versus-force question with specific feedback before acceleration results. The example shows the complete NASA Blue Marble globe, a red apple, equal and opposite gravitational forces, centre-to-centre distance R and the textbook equations F = GmM/R² = mg, a_m = g and a_M = F/M = (m/M)g ≈ 1.64×10^-24 m/s² for m = 1 kg and M = 5.98×10^24 kg. Sizes and separation are explicitly not to scale. Five tap questions connect the pictures to the force-pair principle. Offline, Bangla/English, with self-contained GLB exports. Version 1.0 replaces the equal/unequal skater example IDs with boat; apple remains apple.",
  "tags": ["force", "newtons-laws", "action-reaction", "third-law", "acceleration", "bangla"],
  "params": [
    {
      "name": "lang",
      "label": "Language",
      "type": "select",
      "options": [["bn", "বাংলা"], ["en", "English"]],
      "default": "bn"
    },
    {
      "name": "example",
      "label": "Pair",
      "type": "select",
      "options": [["boat", "boy jumps from a boat"], ["apple", "apple and Earth"]],
      "default": "boat"
    },
    {
      "name": "at",
      "label": "Start already moving",
      "type": "number",
      "default": "",
      "placeholder": "s into the jump or fall",
      "help": "Physical simulation seconds: e.g. 0.18 shows boat contact; 0.55 shows the boy airborne. Boat time is 2× slower; apple time is 6× slower."
    },
    { "name": "view", "label": "View", "type": "select", "options": ["front", "3d"], "default": "front" },
    {
      "name": "mode",
      "label": "Start in",
      "type": "select",
      "options": [["explore", "learn"], ["quiz", "test"]],
      "default": "explore"
    },
    { "name": "coach", "label": "The ring pulses", "type": "boolean", "default": "1" },
    {
      "name": "numerals",
      "label": "Digits",
      "type": "select",
      "options": [["", "follow language"], ["bn", "Bangla"], ["latin", "Latin"]],
      "default": ""
    },
    { "name": "bg", "label": "Background", "type": "select", "options": ["light", "transparent"], "default": "light" },
    { "name": "shadow", "label": "Soft shadow", "type": "boolean", "default": "1" },
    { "name": "sound", "label": "Sound", "type": "boolean", "default": "1" }
  ],
  "commands": [
    { "name": "get", "payload": {} },
    { "name": "set", "payload": { "example": "boat" } },
    { "name": "set", "payload": { "push": true } },
    { "name": "set", "payload": { "at": 0.18 } },
    { "name": "set", "payload": { "example": "apple", "at": 0.2 } },
    { "name": "set", "payload": { "example": "apple", "at": 0.42857, "lessonStep": 2 } },
    { "name": "set", "payload": { "home": true } },
    { "name": "set", "payload": { "view": "3d" } },
    { "name": "reset", "payload": {} },
    { "name": "practice", "payload": {} },
    { "name": "capture", "payload": { "width": 800, "height": 500 } },
    { "name": "export-glb", "payload": {} }
  ],
  "events": [
    "ready",
    "change",
    "push",
    "release",
    "done",
    "example",
    "view",
    "practice-start",
    "practice-result",
    "practice-end"
  ],
  "export": {
    "poster": { "params": { "coach": "0", "example": "boat", "at": "0.55" } },
    "glb": [
      { "name": "default", "setup": [{ "command": "set", "payload": { "example": "boat", "at": 0.55 } }] },
      { "name": "apple-earth", "setup": [{ "command": "set", "payload": { "example": "apple", "at": 0.2 } }] }
    ],
    "video": {
      "kind": "script",
      "seconds": 18,
      "fps": 30,
      "params": { "coach": "0", "example": "boat" },
      "script": [
        { "at": 0.5, "command": "set", "payload": { "push": true } },
        { "at": 5, "command": "set", "payload": { "example": "apple" } },
        { "at": 5.6, "command": "set", "payload": { "push": true } },
        { "at": 8.6, "command": "set", "payload": { "lessonStep": 1 } },
        { "at": 13, "command": "set", "payload": { "lessonStep": 2 } }
      ]
    }
  }
}
