{
  "$schema": "../../schemas/asset.schema.json",
  "schemaVersion": 2,
  "id": "momentum",
  "title": "Momentum (ভরবেগ)",
  "type": "interactive",
  "entry": "index.html",
  "version": "0.1.0",
  "book": "physics-9-10",
  "page": 71,
  "topic": "3.4",
  "placement": "Book pages 71–72, topic 3.4: ভরবেগ (Momentum). Next to the truck-and-bicycle paragraph, p⃗ = mv⃗ and the box with the unit kg m/s and the dimension MLT⁻¹.",
  "order": 1,
  "maintainers": ["RadeenXALNW"],
  "units": "m",
  "description": "Momentum (ভরবেগ, page 71, 3.4) as the book's thought experiment, run by the student: a loaded truck (10 000 kg) and a bicycle with its rider (80 kg) go at the same velocity along a town street, each toward a parked small car. Over each a blue arrow shows its velocity v (the same length for both) and a green arrow its momentum p = m v, both p arrows on one scale: the bicycle's is short, the truck's, 125 times as long, runs off the screen, with a label at the edge saying so. The panel writes p = m v with the numbers for both (kg m/s) and the book's box (unit kg m/s, dimension [p] = MLT⁻¹). A tap on the truck (or চালাও) plays the run in real time: the truck crumples its car and shoves it about 2 m, the bicycle moves its car about a centimetre. The student changes the velocity (1–8 m/s: both factors matter) and the direction (to the left is negative: the arrows turn, the numbers get a minus). Test tab: 5 questions on their own pictures (which does more damage and why, p of a body read off the picture, a slow heavy body against a fast light one, the velocity doubled, the sign of p moving left). Phone-first, Bangla.",
  "tags": ["momentum", "mass", "velocity", "vector", "collision", "force", "bangla"],
  "params": [
    {
      "name": "lang",
      "label": "Language",
      "type": "select",
      "options": [["bn", "বাংলা"], ["en", "English"]],
      "default": "bn"
    },
    {
      "name": "speed",
      "label": "Velocity (m/s)",
      "type": "number",
      "default": "5",
      "placeholder": "1–8",
      "help": "the same for the truck and the bicycle"
    },
    {
      "name": "dir",
      "label": "Direction",
      "type": "select",
      "options": [["right", "to the right (+)"], ["left", "to the left (−)"]],
      "default": "right"
    },
    {
      "name": "at",
      "label": "Moment of the run",
      "type": "number",
      "default": "",
      "placeholder": "s after the start",
      "help": "shown paused, e.g. 1 (just before the crash at 5 m/s); past the end shows the result"
    },
    { "name": "view", "label": "View", "type": "select", "options": ["front", "3d"], "default": "front" },
    {
      "name": "mode",
      "label": "Start in",
      "type": "select",
      "options": [["explore", "learn"], ["quiz", "test"]],
      "default": "explore"
    },
    { "name": "coach", "label": "First-use pointers", "type": "boolean", "default": "1" },
    {
      "name": "numerals",
      "label": "Digits",
      "type": "select",
      "options": [["", "follow language"], ["bn", "Bangla"], ["latin", "Latin"]],
      "default": ""
    },
    { "name": "bg", "label": "Background", "type": "select", "options": ["light", "transparent"], "default": "light" },
    { "name": "shadow", "label": "Soft shadow", "type": "boolean", "default": "1" },
    { "name": "sound", "label": "Sound", "type": "boolean", "default": "1" }
  ],
  "commands": [
    { "name": "get", "payload": {} },
    { "name": "set", "payload": { "speed": 8 } },
    { "name": "set", "payload": { "dir": "left" } },
    { "name": "set", "payload": { "play": true } },
    { "name": "set", "payload": { "at": 1 } },
    { "name": "set", "payload": { "at": 99 } },
    { "name": "set", "payload": { "view": "3d" } },
    { "name": "reset", "payload": {} },
    { "name": "practice", "payload": {} },
    { "name": "capture", "payload": { "width": 800, "height": 500 } },
    { "name": "export-glb", "payload": {} }
  ],
  "events": ["ready", "change", "play", "crash", "rest", "view", "practice-start", "practice-result", "practice-end"],
  "export": {
    "poster": { "params": { "coach": "0", "at": "1" } },
    "glb": [
      { "name": "default", "setup": [{ "command": "set", "payload": { "at": 0, "animate": false } }] },
      { "name": "crash", "setup": [{ "command": "set", "payload": { "at": 99, "animate": false } }] }
    ],
    "video": {
      "kind": "script",
      "seconds": 18,
      "fps": 30,
      "params": { "coach": "0" },
      "script": [
        { "at": 0.8, "command": "set", "payload": { "play": true } },
        { "at": 5, "command": "set", "payload": { "speed": 8 } },
        { "at": 6, "command": "set", "payload": { "play": true } },
        { "at": 10.5, "command": "set", "payload": { "speed": 4, "dir": "left" } },
        { "at": 11.5, "command": "set", "payload": { "play": true } }
      ]
    }
  }
}
