{
  "$schema": "../../schemas/asset.schema.json",
  "schemaVersion": 2,
  "id": "speed-velocity",
  "title": "Speed and velocity (দ্রুতি এবং বেগ)",
  "type": "interactive",
  "entry": "index.html",
  "version": "0.1.0",
  "book": "physics-9-10",
  "page": 40,
  "topic": "2.5",
  "placement": "Book pages 40–41, topic 2.5: দ্রুতি এবং বেগ. Next to the section text and its example (A to B in 20 minutes on the winding road of চিত্র ২.০৪).",
  "order": 1,
  "maintainers": ["RadeenXALNW"],
  "units": "m",
  "description": "Speed and velocity (দ্রুতি এবং বেগ, pages 40–41, 2.5) in two examples. A student whirls a stone on a rope overhead: its দ্রুতি stays 4 m/s (panel: 6.28 m ÷ 1.57 s per turn), but its বেগ arrow along the circle keeps turning (the panel names its direction live, faint copies show the arrow at earlier moments), so the বেগ keeps changing. Let go of the rope (tap the hand or the button, acting as the finger goes down) and the stone flies straight on along the tangent, falling honestly and landing in or beside a pond: the game is to land it in the pond, which works only if you let go when the বেগ arrow points at it. The book's example on the road of চিত্র ২.০৪: a cyclist goes A to B in 20 minutes (drag the cycle or let it ride) while the panel works out গড় দ্রুতি = 4 km ÷ 20 min = 12 km/h and গড় বেগ = 2 km ÷ 20 min = 6 km/h towards B, with the road travelled (দূরত্ব) and the straight সরণ arrow on the map. Test: 5 tap questions (which way the released stone goes, same দ্রুতি but different বেগ, দ্রুতি or বেগ from book-style numbers, average speed or velocity on the road with minutes to hours, the average velocity of a whole turn). Phone-first, Bangla.",
  "tags": ["motion", "speed", "velocity", "vector", "circular-motion", "displacement", "bangla"],
  "params": [
    {
      "name": "lang",
      "label": "Language",
      "type": "select",
      "options": [["bn", "বাংলা"], ["en", "English"]],
      "default": "bn"
    },
    {
      "name": "scene",
      "label": "Example",
      "type": "select",
      "options": [["stone", "whirling stone"], ["road", "cycle on the road (A to B)"]],
      "default": "stone"
    },
    {
      "name": "view",
      "label": "View",
      "type": "select",
      "options": [["front", "from above"], ["3d", "3d"]],
      "default": "front"
    },
    {
      "name": "mode",
      "label": "Start in",
      "type": "select",
      "options": [["explore", "learn"], ["quiz", "test"]],
      "default": "explore"
    },
    { "name": "coach", "label": "First-use pointers", "type": "boolean", "default": "1" },
    {
      "name": "numerals",
      "label": "Digits",
      "type": "select",
      "options": [["", "follow language"], ["bn", "Bangla"], ["latin", "Latin"]],
      "default": ""
    },
    { "name": "bg", "label": "Background", "type": "select", "options": ["light", "transparent"], "default": "light" },
    { "name": "shadow", "label": "Soft shadow", "type": "boolean", "default": "1" },
    { "name": "sound", "label": "Sound", "type": "boolean", "default": "1" }
  ],
  "commands": [
    { "name": "get", "payload": {} },
    { "name": "set", "payload": { "scene": "stone" } },
    { "name": "set", "payload": { "angle": 215, "whirl": false } },
    { "name": "set", "payload": { "release": true } },
    { "name": "set", "payload": { "release": 331, "animate": false } },
    { "name": "set", "payload": { "whirl": true } },
    { "name": "set", "payload": { "scene": "road" } },
    { "name": "set", "payload": { "km": 2.5 } },
    { "name": "set", "payload": { "minutes": 20 } },
    { "name": "set", "payload": { "km": 0, "playing": true } },
    { "name": "reset", "payload": {} },
    { "name": "practice", "payload": {} },
    { "name": "capture", "payload": { "width": 800, "height": 500 } },
    { "name": "export-glb", "payload": {} }
  ],
  "events": [
    "ready",
    "change",
    "scene",
    "release",
    "land",
    "arrive",
    "view",
    "practice-start",
    "practice-result",
    "practice-end"
  ],
  "export": {
    "poster": {
      "params": { "coach": "0" },
      "setup": [{ "command": "set", "payload": { "angle": 215, "whirl": false, "animate": false } }]
    },
    "glb": [
      {
        "name": "default",
        "setup": [{ "command": "set", "payload": { "angle": 215, "whirl": false, "animate": false } }]
      },
      { "name": "road", "setup": [{ "command": "set", "payload": { "km": 4, "animate": false } }] }
    ],
    "video": {
      "kind": "script",
      "seconds": 19,
      "fps": 30,
      "params": { "coach": "0" },
      "script": [
        { "at": 0.5, "command": "set", "payload": { "angle": 64 } },
        { "at": 4, "command": "set", "payload": { "release": 331 } },
        { "at": 8, "command": "set", "payload": { "scene": "road" } }
      ]
    }
  }
}
